[
  {
    "id": "EF-01",
    "title": "Efficiency metrics collected",
    "category": "efficiency",
    "difficulty": "simple",
    "natural_user_prompt": "Прочитай hello.txt.",
    "preconditions": [],
    "workspace_setup": {
      "kind": "eval_dir",
      "name": "local-computer",
      "files": {
        "hello.txt": "Alex Local Computer REAL PASS\n",
        "alpha.txt": "no marker\n",
        "beta.md": "# note\n",
        "data.json": "{\"marker\": \"ALEX_SEARCH_MARKER_49127\"}\n"
      }
    },
    "expected_capabilities": [],
    "expected_tool_family": [
      "read_file"
    ],
    "forbidden_tools": [
      "web_search",
      "web_fetch",
      "web_agent",
      "web_browser",
      "browser_start",
      "browser_read",
      "browser_write",
      "web_agent_read"
    ],
    "success_criteria": [
      {
        "kind": "metrics_present"
      }
    ],
    "verification": {
      "mode": "mechanical"
    },
    "max_tool_calls": 3,
    "max_runtime_seconds": 180,
    "max_paid_cost_usd": 0,
    "cleanup": {
      "strategy": "delete_eval_workspace_only",
      "preserve_user_files": true,
      "never_delete": [
        "C:\\Users\\Volkr\\Documents",
        "C:\\Users\\Volkr\\Desktop\\резюме"
      ]
    },
    "weak_model_risks": [],
    "deterministic_fallback_expected": false,
    "notes": "Report must record calls, duplicates, violations, runtime, paid cost=0.",
    "live": false,
    "expected_mock_status": "SKIPPED",
    "suite": "efficiency"
  }
]
